index,index_0,index_1,index_2,index_3,index_4,id_0,id_1,id_2,id_3,id_4,question_0,question_1,question_2,question_3,question_4,answer_0,answer_1,answer_2,answer_3,answer_4,output_answer_0,output_answer_1,output_answer_2,output_answer_3,output_answer_4,output_explanation_0,output_explanation_1,output_explanation_2,output_explanation_3,output_explanation_4,explanation_0,explanation_1,explanation_2,explanation_3,explanation_4,processed_question_0,processed_question_1,processed_question_2,processed_question_3,processed_question_4,answer0_0,answer0_1,answer0_2,answer0_3,answer0_4,answer1_0,answer1_1,answer1_2,answer1_3,answer1_4,answer2_0,answer2_1,answer2_2,answer2_3,answer2_4,answer3_0,answer3_1,answer3_2,answer3_3,answer3_4,img_name_0,img_name_1,img_name_2,img_name_3,img_name_4
85,8680,12568,9109,25629,5893,val-8681,val-12569,val-9110,val-25630,val-5894,"What are person0 ( <bin_218> <bin_69> <bin_470> <bin_978> ) and person4 ( <bin_405> <bin_87> <bin_765> <bin_987> ), and person5 ( <bin_0> <bin_19> <bin_290> <bin_993> ) doing ? answer0: person7 ( <bin_459> <bin_325> <bin_522> <bin_445> ) and person1 ( <bin_867> <bin_335> <bin_956> <bin_955> ), and person5 ( <bin_0> <bin_19> <bin_290> <bin_993> ) are watching a performance over drinks. answer1: They are all playing the violin. answer2: person0 ( <bin_218> <bin_69> <bin_470> <bin_978> ) and person4 ( <bin_405> <bin_87> <bin_765> <bin_987> ), and person5 ( <bin_0> <bin_19> <bin_290> <bin_993> ) are talking about their days over supper. answer3: person0 ( <bin_218> <bin_69> <bin_470> <bin_978> ) and person4 ( <bin_405> <bin_87> <bin_765> <bin_987> ), and person5 ( <bin_0> <bin_19> <bin_290> <bin_993> ) are working",Why is person2 ( <bin_445> <bin_70> <bin_619> <bin_841> ) stirring pots on the stove ? answer0: He's warming up for a show. answer1: He is a servant to person2 ( <bin_445> <bin_70> <bin_619> <bin_841> ). answer2: He is the host. answer3: He is preparing a meal,Why is person0 ( <bin_297> <bin_276> <bin_438> <bin_959> ) shopping ? answer0: Some of the diner ware is hers. answer1: person0 ( <bin_297> <bin_276> <bin_438> <bin_959> ) is shopping for things she needs at home. answer2: She wants to get her eye sight checked and to buy glasses. answer3: She wants to buy food for dinner,What is person1 ( <bin_515> <bin_151> <bin_804> <bin_996> ) drinking ? answer0: He is drinking a class of scotch. answer1: He is drinking coffee. answer2: He is drinking cognac. answer3: He's drinking a beer,What did person7 ( <bin_419> <bin_319> <bin_519> <bin_612> ) and person12 ( <bin_800> <bin_321> <bin_989> <bin_663> ) just do ? answer0: They dragged a body from the water. answer1: They just got married. answer2: person7 ( <bin_419> <bin_319> <bin_519> <bin_612> ) and person12 ( <bin_800> <bin_321> <bin_989> <bin_663> ) fought each other. answer3: person7 ( <bin_419> <bin_319> <bin_519> <bin_612> ) and person12 ( <bin_800> <bin_321> <bin_989> <bin_663> ) got person10 ( <bin_735> <bin_580> <bin_820> <bin_955> ) released from jail,answer1,answer3,answer1,answer1,answer1,answer1,answer3,answer1,answer1,answer1,They are all holding violins and are playing them,He is wearing a chef's coat and hat and is stirring a pot on the stove,person0 is in a convenience store,He is holding a coffee cup,They are wearing nice dresses and are in the middle of a crowd,They are holding violins in the manner which you hold them while you play,People stir food in the pots in order for them to not burn the food,A lot of people go to stores to do their shopping for their needs at home like food and supplies,His hair appears wet and he is holding a blanket around him this suggests he is trying to warm up and people often use coffee for that,person12 is in a wedding dress and person7 is dressed like a groom,"What are person0 and person4, and person5 doing",Why is person2 stirring pots on the stove,Why is person0 shopping,What is person1 drinking,What did person7 and person12 just do,"person7 and person1, and person5 are watching a performance over drinks.",He's warming up for a show.,Some of the diner ware is hers.,He is drinking a class of scotch.,They dragged a body from the water.,They are all playing the violin.,He is a servant to person2.,person0 is shopping for things she needs at home.,He is drinking coffee.,They just got married.,"person0 and person4, and person5 are talking about their days over supper.",He is the host.,She wants to get her eye sight checked and to buy glasses.,He is drinking cognac.,person7 and person12 fought each other.,"person0 and person4, and person5 are working",He is preparing a meal,She wants to buy food for dinner,He's drinking a beer,person7 and person12 got person10 released from jail,val-8681.jpg,val-12569.jpg,val-9110.jpg,val-25630.jpg,val-5894.jpg
90,4463,20971,4115,9904,9097,val-4464,val-20972,val-4116,val-9905,val-9098,"Will person0 ( <bin_62> <bin_144> <bin_446> <bin_998> ) and person1 ( <bin_375> <bin_81> <bin_551> <bin_977> ) be going sailing in boat0 ( <bin_754> <bin_342> <bin_996> <bin_980> ) ? answer0: Yes, boat0 ( <bin_754> <bin_342> <bin_996> <bin_980> ) will make it off okay. answer1: No, they are not planning to go swimming. answer2: person0 ( <bin_62> <bin_144> <bin_446> <bin_998> ) and person1 ( <bin_375> <bin_81> <bin_551> <bin_977> ) might get out of boat0 ( <bin_754> <bin_342> <bin_996> <bin_980> ). answer3: No, they won't","Are person2 ( <bin_369> <bin_417> <bin_388> <bin_477> ) and person3 ( <bin_396> <bin_412> <bin_415> <bin_465> ) with person1 ( <bin_470> <bin_196> <bin_591> <bin_589> ) and person0 ( <bin_736> <bin_147> <bin_845> <bin_631> ) ? answer0: Yes, they are together. answer1: No, person2 ( <bin_369> <bin_417> <bin_388> <bin_477> ) and person3 ( <bin_396> <bin_412> <bin_415> <bin_465> ), and person1 ( <bin_470> <bin_196> <bin_591> <bin_589> ) and person0 ( <bin_736> <bin_147> <bin_845> <bin_631> ) are not looking at horse2 ( <bin_392> <bin_445> <bin_417> <bin_548> ). answer2: They are not. answer3: No, person1 ( <bin_470> <bin_196> <bin_591> <bin_589> ) and person0 ( <bin_736> <bin_147> <bin_845> <bin_631> ) are watching the film",What is person2 ( <bin_382> <bin_565> <bin_436> <bin_684> ) doing ? answer0: She is helping person2 ( <bin_382> <bin_565> <bin_436> <bin_684> ) get ready. answer1: She is sleeping. answer2: She's eating a meal. answer3: She is threatening person2 ( <bin_382> <bin_565> <bin_436> <bin_684> ),What will person0 ( <bin_339> <bin_90> <bin_616> <bin_995> ) do if startled ? answer0: person0 ( <bin_339> <bin_90> <bin_616> <bin_995> ) will be worried by what he sees. answer1: He will close the door quietly behind him. answer2: He will pull his gun out. answer3: He will advance toward the open door and leave the room,How does person2 ( <bin_310> <bin_312> <bin_459> <bin_802> ) feel about person0 ( <bin_314> <bin_34> <bin_711> <bin_998> ) ? answer0: She feels that she is disappointing her. answer1: She seems to like him a little. answer2: person2 ( <bin_310> <bin_312> <bin_459> <bin_802> ) is puzzled about her behavior. answer3: She does not like him,answer3,answer2,answer1,answer2,answer1,answer3,answer2,answer1,answer2,answer1,boat0 is a lifeboat and person0 and person1 are wearing coats and gloves,They are all walking in the same direction,She is wearing an apron and is in a bedroom,He is a police officer and he is standing in the middle of the street with a gun,She is smiling at him and she is looking at him with a slight smile,They are not dressed for sailing,person2 and person3 are on the other side of the river if they were together they would all be on the same side,Her head is on a pillow,person0's hand is already hovering near his weapon and police are generally prepared to pull out a gun in case of danger,person2 looks towards person0 and has a smirk on her face,Will person0 and person1 be going sailing in boat0,Are person2 and person3 with person1 and person0,What is person2 doing,What will person0 do if startled,How does person2 feel about person0,"Yes, boat0 will make it off okay.","Yes, they are together.",She is helping person2 get ready.,person0 will be worried by what he sees.,She feels that she is disappointing her.,"No, they are not planning to go swimming.","No, person2 and person3, and person1 and person0 are not looking at horse2.",She is sleeping.,He will close the door quietly behind him.,She seems to like him a little.,person0 and person1 might get out of boat0.,They are not.,She's eating a meal.,He will pull his gun out.,person2 is puzzled about her behavior.,"No, they won't","No, person1 and person0 are watching the film",She is threatening person2,He will advance toward the open door and leave the room,She does not like him,val-4464.jpg,val-20972.jpg,val-4116.jpg,val-9905.jpg,val-9098.jpg
95,19267,305,24442,14741,10145,val-19268,val-306,val-24443,val-14742,val-10146,What is person0 ( <bin_274> <bin_172> <bin_584> <bin_958> ) doing ? answer0: person0 ( <bin_274> <bin_172> <bin_584> <bin_958> ) is putting on a dance class for the kids at mcdonald's. answer1: person0 ( <bin_274> <bin_172> <bin_584> <bin_958> ) is mixing paint. answer2: person0 ( <bin_274> <bin_172> <bin_584> <bin_958> ) is giving orders to person2 ( <bin_589> <bin_243> <bin_785> <bin_858> ) and person1 ( <bin_498> <bin_190> <bin_635> <bin_789> ). answer3: person0 ( <bin_274> <bin_172> <bin_584> <bin_958> ) is getting some food,"What is person0 ( <bin_92> <bin_69> <bin_534> <bin_992> ) probably feeling ? answer0: person0 ( <bin_92> <bin_69> <bin_534> <bin_992> ) is probably feeling unhappy. answer1: Fear, sadness, and an overall bleak feeling. answer2: person0 ( <bin_92> <bin_69> <bin_534> <bin_992> ) is feeling fear. answer3: person1 ( <bin_417> <bin_733> <bin_540> <bin_989> ) is probably feeling sassy","Why has person0 ( <bin_510> <bin_336> <bin_619> <bin_978> ) brought everyone out onto the streets ? answer0: person0 ( <bin_510> <bin_336> <bin_619> <bin_978> ) wants to leave here as soon as possible. answer1: person0 ( <bin_510> <bin_336> <bin_619> <bin_978> ) needs help picking up all the loose contraband. answer2: person0 ( <bin_510> <bin_336> <bin_619> <bin_978> ) has gotten a new job in the city. answer3: An event happened, such as a car crash or maybe a parade",What is person1 ( <bin_618> <bin_198> <bin_746> <bin_885> ) about to do ? answer0: person1 ( <bin_618> <bin_198> <bin_746> <bin_885> ) is about to speak to person0 ( <bin_153> <bin_313> <bin_285> <bin_880> ). answer1: person2 ( <bin_283> <bin_561> <bin_310> <bin_584> ) is about to order a drink. answer2: person0 ( <bin_153> <bin_313> <bin_285> <bin_880> ) is about to go to sleep for the night. answer3: person2 ( <bin_283> <bin_561> <bin_310> <bin_584> ) is going to hit diningtable0 ( <bin_261> <bin_574> <bin_665> <bin_868> ),How does person0 ( <bin_94> <bin_68> <bin_347> <bin_960> ) know person2 ( <bin_447> <bin_45> <bin_992> <bin_998> ) ? answer0: She is on a date with him. answer1: person0 ( <bin_94> <bin_68> <bin_347> <bin_960> ) is the girlfriend or wife of person2 ( <bin_447> <bin_45> <bin_992> <bin_998> ). answer2: person2 ( <bin_447> <bin_45> <bin_992> <bin_998> ) may be her husband and person5 ( <bin_857> <bin_304> <bin_952> <bin_595> ) is her daughter. answer3: person0 ( <bin_94> <bin_68> <bin_347> <bin_960> ) is person2 ( <bin_447> <bin_45> <bin_992> <bin_998> )'s mother,answer1,answer0,answer1,answer0,answer0,answer1,answer0,answer1,answer0,answer0,person0 is holding a paintbrush and there are paint buckets on the table,The woman's eyes are closed and her mouth is open,person0 is a police officer and is trying to help out,person1 is standing in front of person0 and is looking at her,They are sitting at a table together and person0 is smiling at person2,person0 is using a bucket used for paint and holding a paint brush,She is frowning and looking sown,Before the crowd are multiple packs of cigarettes laying on the street unclaimed,The way his mouth is open looks as if he is just about to start a conversation,They are dressed up and are sitting in a restaurant,What is person0 doing,What is person0 probably feeling,Why has person0 brought everyone out onto the streets,What is person1 about to do,How does person0 know person2,person0 is putting on a dance class for the kids at mcdonald's.,person0 is probably feeling unhappy.,person0 wants to leave here as soon as possible.,person1 is about to speak to person0.,She is on a date with him.,person0 is mixing paint.,"Fear, sadness, and an overall bleak feeling.",person0 needs help picking up all the loose contraband.,person2 is about to order a drink.,person0 is the girlfriend or wife of person2.,person0 is giving orders to person2 and person1.,person0 is feeling fear.,person0 has gotten a new job in the city.,person0 is about to go to sleep for the night.,person2 may be her husband and person5 is her daughter.,person0 is getting some food,person1 is probably feeling sassy,"An event happened, such as a car crash or maybe a parade",person2 is going to hit diningtable0,person0 is person2's mother,val-19268.jpg,val-306.jpg,val-24443.jpg,val-14742.jpg,val-10146.jpg
100,12882,16345,3214,23521,1895,val-12883,val-16346,val-3215,val-23522,val-1896,Why is person0 ( <bin_133> <bin_186> <bin_291> <bin_869> ) wearing pajamas ? answer0: He is in a dressing room. answer1: person1 ( <bin_467> <bin_180> <bin_677> <bin_694> ) has woken him up in the middle of the night. answer2: He's still in his bathrobe and it's getting late in the day. answer3: He is getting ready to go to sleep,How shocked is person0 ( <bin_453> <bin_137> <bin_791> <bin_876> ) right now ? answer0: person0 ( <bin_453> <bin_137> <bin_791> <bin_876> ) is feeling very shocked right now. answer1: person0 ( <bin_453> <bin_137> <bin_791> <bin_876> ) just heard some unbelievable news. answer2: person0 ( <bin_453> <bin_137> <bin_791> <bin_876> ) is terrified right now. answer3: person0 ( <bin_453> <bin_137> <bin_791> <bin_876> ) looks surprised,What are person0 ( <bin_531> <bin_341> <bin_703> <bin_915> ) and person1 ( <bin_320> <bin_372> <bin_506> <bin_949> ) looking at ? answer0: Somebody the are waiting appeared finally. answer1: person0 ( <bin_531> <bin_341> <bin_703> <bin_915> ) and person1 ( <bin_320> <bin_372> <bin_506> <bin_949> ) are looking at diningtable0 ( <bin_441> <bin_680> <bin_614> <bin_979> ). answer2: person0 ( <bin_531> <bin_341> <bin_703> <bin_915> ) and person1 ( <bin_320> <bin_372> <bin_506> <bin_949> ) are likely watching a musically performance that is enticing them to clap with the beat. answer3: person0 ( <bin_531> <bin_341> <bin_703> <bin_915> ) and person1 ( <bin_320> <bin_372> <bin_506> <bin_949> ) are looking at a television,Why are person5 ( <bin_585> <bin_448> <bin_708> <bin_832> ) and person7 ( <bin_305> <bin_426> <bin_425> <bin_797> ) kneeling ? answer0: They are praying. answer1: person5 ( <bin_585> <bin_448> <bin_708> <bin_832> ) and person7 ( <bin_305> <bin_426> <bin_425> <bin_797> ) is trying to take an offensive stance while maximizing firepower in their squad. answer2: They don't want to fall in the water. answer3: person2 ( <bin_866> <bin_347> <bin_914> <bin_566> ) is a priest and trying to console person13 ( <bin_683> <bin_249> <bin_768> <bin_758> ),Why does person0 ( <bin_512> <bin_419> <bin_724> <bin_998> ) look scared of person1 ( <bin_12> <bin_72> <bin_426> <bin_991> ) ? answer0: person0 ( <bin_512> <bin_419> <bin_724> <bin_998> ) is afraid of what person1 ( <bin_12> <bin_72> <bin_426> <bin_991> ) will do to person0 ( <bin_512> <bin_419> <bin_724> <bin_998> ). answer1: person1 ( <bin_12> <bin_72> <bin_426> <bin_991> ) looks very professional to a child and intimidating as an authority figure. answer2: Because person1 ( <bin_12> <bin_72> <bin_426> <bin_991> ) is trying to kidnap person0 ( <bin_512> <bin_419> <bin_724> <bin_998> ). answer3: person1 ( <bin_12> <bin_72> <bin_426> <bin_991> ) is a ghost that is haunting person0 ( <bin_512> <bin_419> <bin_724> <bin_998> ),answer1,answer0,answer3,answer1,answer1,answer1,answer0,answer3,answer1,answer1,person1 is wearing pajamas and person0 is wearing a t - shirt,person0's mouth is open and her eyes are wide,person0 and person1 are sitting in a room with a television on the table in front of them,person5 and person7 are in a defensive stance while their squad is shooting at them,person0 is a child and person1 is an adult,"person0 is not involved in whatever person1 has doing, looks ruffled from sleep","person0's facial expression is drawn back, and her eyes are bugged out wide also, her mouth is opened in shocked expression",person0 and person1 are looking down and to the right at a television set,person3 and person9 are behind them in similar stances but standing,person0 has a fearful expression on his face,Why is person0 wearing pajamas,How shocked is person0 right now,What are person0 and person1 looking at,Why are person5 and person7 kneeling,Why does person0 look scared of person1,He is in a dressing room.,person0 is feeling very shocked right now.,Somebody the are waiting appeared finally.,They are praying.,person0 is afraid of what person1 will do to person0.,person1 has woken him up in the middle of the night.,person0 just heard some unbelievable news.,person0 and person1 are looking at diningtable0.,person5 and person7 is trying to take an offensive stance while maximizing firepower in their squad.,person1 looks very professional to a child and intimidating as an authority figure.,He's still in his bathrobe and it's getting late in the day.,person0 is terrified right now.,person0 and person1 are likely watching a musically performance that is enticing them to clap with the beat.,They don't want to fall in the water.,Because person1 is trying to kidnap person0.,He is getting ready to go to sleep,person0 looks surprised,person0 and person1 are looking at a television,person2 is a priest and trying to console person13,person1 is a ghost that is haunting person0,val-12883.jpg,val-16346.jpg,val-3215.jpg,val-23522.jpg,val-1896.jpg
105,24056,24042,6565,13210,13040,val-24057,val-24043,val-6566,val-13211,val-13041,Why are there so many angles of person1 ( <bin_354> <bin_191> <bin_429> <bin_477> ) ? answer0: person4 ( <bin_564> <bin_173> <bin_602> <bin_306> ) is looking at the rear end of person1 ( <bin_354> <bin_191> <bin_429> <bin_477> ). answer1: person1 ( <bin_354> <bin_191> <bin_429> <bin_477> ) is being recorded on security cameras. answer2: person12 ( <bin_670> <bin_121> <bin_706> <bin_292> ) is floating into the sky. answer3: person12 ( <bin_670> <bin_121> <bin_706> <bin_292> ) is at a japanese restaurant and chopsticks are used in place of a fork,What will person6 ( <bin_507> <bin_312> <bin_699> <bin_793> ) do when the match is over ? answer0: He will bow to person22 ( <bin_305> <bin_492> <bin_437> <bin_787> ). answer1: Ask the others to help him start another one. answer2: He will get back up and dust himself off. answer3: He will keep playing,"Does person2 ( <bin_432> <bin_233> <bin_635> <bin_985> ) want to be with person0 ( <bin_293> <bin_72> <bin_471> <bin_981> ) ? answer0: Yes, she is excited about dancing with him. answer1: No, it looks like person0 ( <bin_293> <bin_72> <bin_471> <bin_981> ) is holding her by force. answer2: Yes person1 ( <bin_28> <bin_13> <bin_409> <bin_987> ) is attracted to her. answer3: No, she is not happy to be there",What are person0 ( <bin_174> <bin_275> <bin_432> <bin_893> ) and person1 ( <bin_387> <bin_21> <bin_784> <bin_992> ) doing ? answer0: person0 ( <bin_174> <bin_275> <bin_432> <bin_893> ) and person1 ( <bin_387> <bin_21> <bin_784> <bin_992> ) are weaving jai alai baskets. answer1: person0 ( <bin_174> <bin_275> <bin_432> <bin_893> ) and person1 ( <bin_387> <bin_21> <bin_784> <bin_992> ) are playing violins. answer2: person0 ( <bin_174> <bin_275> <bin_432> <bin_893> ) and person1 ( <bin_387> <bin_21> <bin_784> <bin_992> ) are yelling for person0 ( <bin_174> <bin_275> <bin_432> <bin_893> ) to come to them. answer3: They look like they are having a sleepover,Why is person1 ( <bin_660> <bin_104> <bin_771> <bin_897> ) shirtless ? answer0: He was working out. answer1: He is in water. answer2: person1 ( <bin_660> <bin_104> <bin_771> <bin_897> ) is showing off his body and plans to do something of an adult nature. answer3: He didn't have time to get dressed,answer1,answer0,answer1,answer0,answer2,answer1,answer0,answer1,answer0,answer2,There are many cameras and people in the room,person22 is already on the ground and person6 is standing in front of him,person2 is holding person0's arms and is looking at him with a look of disgust,person0 and person1 are wearing shirts that say we are jai alai,person1 is standing on a set of stairs and is not wearing a shirt,person1 is being shown from a security control room,People fighting in competition often bow to each other when the match is over,"His hand is very tight on her arm and his other hand is pressed into her side, maybe with a gun",person0 and person1 have the baskets on their laps as they construct the baskets by weaving the strips,person1 is looking intently at person0 and seems intense and focused on her,Why are there so many angles of person1,What will person6 do when the match is over,Does person2 want to be with person0,What are person0 and person1 doing,Why is person1 shirtless,person4 is looking at the rear end of person1.,He will bow to person22.,"Yes, she is excited about dancing with him.",person0 and person1 are weaving jai alai baskets.,He was working out.,person1 is being recorded on security cameras.,Ask the others to help him start another one.,"No, it looks like person0 is holding her by force.",person0 and person1 are playing violins.,He is in water.,person12 is floating into the sky.,He will get back up and dust himself off.,Yes person1 is attracted to her.,person0 and person1 are yelling for person0 to come to them.,person1 is showing off his body and plans to do something of an adult nature.,person12 is at a japanese restaurant and chopsticks are used in place of a fork,He will keep playing,"No, she is not happy to be there",They look like they are having a sleepover,He didn't have time to get dressed,val-24057.jpg,val-24043.jpg,val-6566.jpg,val-13211.jpg,val-13041.jpg
