index,index_0,index_1,index_2,index_3,index_4,id_0,id_1,id_2,id_3,id_4,question_0,question_1,question_2,question_3,question_4,answer_0,answer_1,answer_2,answer_3,answer_4,output_answer_0,output_answer_1,output_answer_2,output_answer_3,output_answer_4,output_explanation_0,output_explanation_1,output_explanation_2,output_explanation_3,output_explanation_4,explanation_0,explanation_1,explanation_2,explanation_3,explanation_4,processed_question_0,processed_question_1,processed_question_2,processed_question_3,processed_question_4,answer0_0,answer0_1,answer0_2,answer0_3,answer0_4,answer1_0,answer1_1,answer1_2,answer1_3,answer1_4,answer2_0,answer2_1,answer2_2,answer2_3,answer2_4,answer3_0,answer3_1,answer3_2,answer3_3,answer3_4,img_name_0,img_name_1,img_name_2,img_name_3,img_name_4
160,15567,13357,2878,17241,113,val-15568,val-13358,val-2879,val-17242,val-114,Why is person0 ( <bin_270> <bin_415> <bin_435> <bin_978> ) raising his hands in the air in haste ? answer0: person0 ( <bin_270> <bin_415> <bin_435> <bin_978> ) is trying to get person2 ( <bin_193> <bin_428> <bin_254> <bin_818> ) to stop what he is doing. answer1: He is frustrated and trying to get the attention of a crowd so that they will listen to him. answer2: person2 ( <bin_193> <bin_428> <bin_254> <bin_818> ) is shocked and amazed at what he is seeing and emphasizing it with his movement. answer3: He is being robbed by the gunman,What are person0 ( <bin_478> <bin_310> <bin_706> <bin_998> ) and person1 ( <bin_266> <bin_275> <bin_486> <bin_998> ) doing ? answer0: person1 ( <bin_266> <bin_275> <bin_486> <bin_998> ) is walking person0 ( <bin_478> <bin_310> <bin_706> <bin_998> ) home. answer1: person0 ( <bin_478> <bin_310> <bin_706> <bin_998> ) and person1 ( <bin_266> <bin_275> <bin_486> <bin_998> ) are dancing. answer2: They are having an awkward conversation. answer3: person0 ( <bin_478> <bin_310> <bin_706> <bin_998> ) is ordering steak while person1 ( <bin_266> <bin_275> <bin_486> <bin_998> ) is ordering chicken tenders,"Can person0 ( <bin_481> <bin_3> <bin_727> <bin_970> ) still give person1 ( <bin_327> <bin_696> <bin_557> <bin_998> ) tea ? answer0: There is no alcohol available at this party only tea is available to drink. answer1: person0 ( <bin_481> <bin_3> <bin_727> <bin_970> ) might give person1 ( <bin_327> <bin_696> <bin_557> <bin_998> ) some money. answer2: No, person1 ( <bin_327> <bin_696> <bin_557> <bin_998> ) is asleep and unresponsive. answer3: Anyone can use cup0 ( <bin_516> <bin_369> <bin_558> <bin_424> ) the way person1 ( <bin_327> <bin_696> <bin_557> <bin_998> ) is, including person0 ( <bin_481> <bin_3> <bin_727> <bin_970> ), without any moral problems",Why has every one come inside ? answer0: A baptism is about to occur. answer1: They are looking for a criminal hiding in the theater. answer2: They just finishing drinking and are leaving. answer3: They were all following person2 ( <bin_225> <bin_263> <bin_373> <bin_886> ),"Will person1 ( <bin_355> <bin_63> <bin_615> <bin_998> ) go after person0 ( <bin_803> <bin_363> <bin_876> <bin_986> ) ? answer0: No he will continue walking. answer1: Yes, he will follow him down the hallway. answer2: No he will not push her. answer3: No, he will not make it to the boat",answer0,answer2,answer2,answer3,answer1,answer0,answer2,answer2,answer3,answer1,person0 is looking at person2 and person2 is pointing a gun at person0,They are sitting very close together and person0 is looking at person1 with a look of confusion,person1 is laying in a chair with her eyes closed and her head tilted back,person2 is walking away from the group and they are all looking at him,person1 is walking towards person0 and person0 is walking towards the hallway,"It seems like everyone wants person2 to stop, but only person0 knows what will happen if he continues","person0 and person1 are sitting next to each other, but not looking directly at each other along with the stiff body language and closed hands, this is normal for people who are having an uncomfortable or awkward conversation",person0 now has to bring the tray back to the kitchen,There is a large gap between person2 and the other people,"He is looking after him, and it would be worthwhile to investigate something that could be a threat",Why is person0 raising his hands in the air in haste,What are person0 and person1 doing,Can person0 still give person1 tea,Why has every one come inside,Will person1 go after person0,person0 is trying to get person2 to stop what he is doing.,person1 is walking person0 home.,There is no alcohol available at this party only tea is available to drink.,A baptism is about to occur.,No he will continue walking.,He is frustrated and trying to get the attention of a crowd so that they will listen to him.,person0 and person1 are dancing.,person0 might give person1 some money.,They are looking for a criminal hiding in the theater.,"Yes, he will follow him down the hallway.",person2 is shocked and amazed at what he is seeing and emphasizing it with his movement.,They are having an awkward conversation.,"No, person1 is asleep and unresponsive.",They just finishing drinking and are leaving.,No he will not push her.,He is being robbed by the gunman,person0 is ordering steak while person1 is ordering chicken tenders,"Anyone can use cup0 the way person1 is, including person0, without any moral problems",They were all following person2,"No, he will not make it to the boat",val-15568.jpg,val-13358.jpg,val-2879.jpg,val-17242.jpg,val-114.jpg
165,4002,21909,13036,14652,17396,val-4003,val-21910,val-13037,val-14653,val-17397,Why does person2 ( <bin_246> <bin_667> <bin_421> <bin_996> ) have his hand in the air ? answer0: He is drawing attention to the folder. answer1: He is angrily gesturing with a gun in his hand. answer2: He is using his hands to illustrate how far he had driven to be there. answer3: He is trying to get the attention of person0 ( <bin_408> <bin_8> <bin_932> <bin_982> ),"Why are there so many bottle like bottle3 ( <bin_702> <bin_472> <bin_723> <bin_601> ) around ? answer0: This is a bar fight. answer1: This office building is for a company that produces extract. answer2: person0 ( <bin_165> <bin_85> <bin_539> <bin_840> ) and person1 ( <bin_509> <bin_240> <bin_992> <bin_995> ) are not in a bar, they are in a drugstore in the nineteen fifties. answer3: person1 ( <bin_509> <bin_240> <bin_992> <bin_995> ) drinking from bottle3 ( <bin_702> <bin_472> <bin_723> <bin_601> ) is significant","Where is person1 ( <bin_7> <bin_129> <bin_451> <bin_957> ) right now ? answer0: person1 ( <bin_7> <bin_129> <bin_451> <bin_957> ) is in a flash mob. answer1: person1 ( <bin_7> <bin_129> <bin_451> <bin_957> ) is at a smart, formal restaurant. answer2: person1 ( <bin_7> <bin_129> <bin_451> <bin_957> ) is in a ballet class. answer3: person1 ( <bin_7> <bin_129> <bin_451> <bin_957> ) is at a party",What was person1 ( <bin_689> <bin_480> <bin_763> <bin_712> ) doing ? answer0: She was sunbathing on the boat. answer1: She was picking flowers. answer2: She was cooking dinner. answer3: She was driving boat0 ( <bin_139> <bin_307> <bin_966> <bin_868> ),Why is person1 ( <bin_163> <bin_184> <bin_333> <bin_868> ) transparent ? answer0: person0 ( <bin_442> <bin_169> <bin_733> <bin_874> ) is a sculpture of a person. answer1: person0 ( <bin_442> <bin_169> <bin_733> <bin_874> ) is flying away from the bright light. answer2: person0 ( <bin_442> <bin_169> <bin_733> <bin_874> ) has been cursed and is floating away. answer3: person1 ( <bin_163> <bin_184> <bin_333> <bin_868> ) is a ghost that is haunting person0 ( <bin_442> <bin_169> <bin_733> <bin_874> ),answer3,answer1,answer2,answer0,answer3,answer3,answer1,answer2,answer0,answer3,person0 is looking at person2 and person2 is looking at person0,The bottles are all in a office setting and there are many books and papers on the shelves,"person1 is surrounded by other people in similar outfits, and they are all wearing ballet costumes",She is wearing a bikini and is laying on the boat's deck,person1 is transparent and appears to be moving away from person0,People wave their hands to get other people's attention,Many times company offices contain the products they make there are many extract bottles in this office,person1 is surrounding by little girls dancing in white tutu,She is sitting on the aft of the boat and wearing revealing clothing,Ghosts are typically transparent beings that haunt real people,Why does person2 have his hand in the air,Why are there so many bottle like bottle3 around,Where is person1 right now,What was person1 doing,Why is person1 transparent,He is drawing attention to the folder.,This is a bar fight.,person1 is in a flash mob.,She was sunbathing on the boat.,person0 is a sculpture of a person.,He is angrily gesturing with a gun in his hand.,This office building is for a company that produces extract.,"person1 is at a smart, formal restaurant.",She was picking flowers.,person0 is flying away from the bright light.,He is using his hands to illustrate how far he had driven to be there.,"person0 and person1 are not in a bar, they are in a drugstore in the nineteen fifties.",person1 is in a ballet class.,She was cooking dinner.,person0 has been cursed and is floating away.,He is trying to get the attention of person0,person1 drinking from bottle3 is significant,person1 is at a party,She was driving boat0,person1 is a ghost that is haunting person0,val-4003.jpg,val-21910.jpg,val-13037.jpg,val-14653.jpg,val-17397.jpg
170,12524,8446,24963,14526,6334,val-12525,val-8447,val-24964,val-14527,val-6335,What will person0 ( <bin_471> <bin_138> <bin_761> <bin_981> ) do next ? answer0: He is will turn and talk to person1 ( <bin_94> <bin_44> <bin_455> <bin_989> ). answer1: He will whip the horses. answer2: He will take a sip of his drink. answer3: He will hang his coat on the coat hanger,What would happen if person0 ( <bin_154> <bin_335> <bin_292> <bin_547> ) removed their white jacket ? answer0: person0 ( <bin_154> <bin_335> <bin_292> <bin_547> ) would state it is comfortable. answer1: person1 ( <bin_615> <bin_426> <bin_722> <bin_655> ) would get covered in snow. answer2: They would go inside. answer3: person0 ( <bin_154> <bin_335> <bin_292> <bin_547> ) would sink into the water,What is person1 ( <bin_39> <bin_644> <bin_236> <bin_980> ) in the middle of ? answer0: person1 ( <bin_39> <bin_644> <bin_236> <bin_980> ) is engaged in war. answer1: person0 ( <bin_349> <bin_159> <bin_628> <bin_980> ) is driving on a road through a festival. answer2: person1 ( <bin_39> <bin_644> <bin_236> <bin_980> ) is taking a test. answer3: person1 ( <bin_39> <bin_644> <bin_236> <bin_980> ) is in the middle of purchasing the grapes,Why are person0 ( <bin_558> <bin_140> <bin_835> <bin_986> ) and person2 ( <bin_354> <bin_308> <bin_557> <bin_983> ) staring at each other ? answer0: person4 ( <bin_0> <bin_7> <bin_325> <bin_988> ) is trying to kiss person2 ( <bin_354> <bin_308> <bin_557> <bin_983> ). answer1: person2 ( <bin_354> <bin_308> <bin_557> <bin_983> ) is mad at person3 ( <bin_807> <bin_444> <bin_908> <bin_911> ). answer2: person0 ( <bin_558> <bin_140> <bin_835> <bin_986> ) is picking on person2 ( <bin_354> <bin_308> <bin_557> <bin_983> ) and making sure person2 ( <bin_354> <bin_308> <bin_557> <bin_983> ) backs down. answer3: They are having a conversation,What kind of event is this ? answer0: This is a after - work party. answer1: A disco party is being held. answer2: It's a formal event. answer3: This event is an outdoor wedding,answer0,answer3,answer2,answer2,answer3,answer0,answer3,answer2,answer2,answer3,person0 is walking towards person1 and is looking at him,The white jacket is keeping person0 afloat,person1 is holding cellphone0 and is looking at a paper,person0 is looking at person2 and person2 is looking down at the ground,Everyone is dressed up and there are a lot of people,They are walking close together,The white jacket person0 is wearing is a life vest,"person1 is sitting at a desk with a pen in her hand and looking down at a pile of paper in front of her, which is typical in test environments",person0 is older than person2 and sometimes older kids pick on younger kids,There are people dressed formally turned around looking at someone,What will person0 do next,What would happen if person0 removed their white jacket,What is person1 in the middle of,Why are person0 and person2 staring at each other,What kind of event is this,He is will turn and talk to person1.,person0 would state it is comfortable.,person1 is engaged in war.,person4 is trying to kiss person2.,This is a after - work party.,He will whip the horses.,person1 would get covered in snow.,person0 is driving on a road through a festival.,person2 is mad at person3.,A disco party is being held.,He will take a sip of his drink.,They would go inside.,person1 is taking a test.,person0 is picking on person2 and making sure person2 backs down.,It's a formal event.,He will hang his coat on the coat hanger,person0 would sink into the water,person1 is in the middle of purchasing the grapes,They are having a conversation,This event is an outdoor wedding,val-12525.jpg,val-8447.jpg,val-24964.jpg,val-14527.jpg,val-6335.jpg
175,11092,8775,18849,25596,16764,val-11093,val-8776,val-18850,val-25597,val-16765,Where is everyone standing right now ? answer0: They are at an office or a work party. answer1: They are at the dinner table. answer2: They are standing on a ship. answer3: They are in a restaurant,What is person2 ( <bin_465> <bin_136> <bin_662> <bin_992> ) proposing to the crowd ? answer0: He is begging the people to be reasonable with their demands. answer1: person2 ( <bin_465> <bin_136> <bin_662> <bin_992> ) is trying to sell person0 ( <bin_275> <bin_191> <bin_493> <bin_997> ) and person3 ( <bin_600> <bin_176> <bin_816> <bin_994> ) and person6 ( <bin_399> <bin_165> <bin_846> <bin_998> ) on his proposal for what they do on this trip. answer2: Accessing the damage that his employees caused. answer3: He is trying to motivate them to leave this room and cheer up,Why is person0 ( <bin_145> <bin_447> <bin_384> <bin_668> ) lounging on couch0 ( <bin_104> <bin_361> <bin_702> <bin_836> ) when person1 ( <bin_643> <bin_224> <bin_911> <bin_734> ) is in a wheelchair ? answer0: They were in an accident and can't sit up. answer1: person0 ( <bin_145> <bin_447> <bin_384> <bin_668> ) is trying to make person1 ( <bin_643> <bin_224> <bin_911> <bin_734> ) more comfortable. answer2: person0 ( <bin_145> <bin_447> <bin_384> <bin_668> ) is aged and injured. answer3: person0 ( <bin_145> <bin_447> <bin_384> <bin_668> ) is using crutches,Why is person0 ( <bin_282> <bin_207> <bin_828> <bin_998> ) looking at refrigerator0 ( <bin_31> <bin_1> <bin_804> <bin_918> ) ? answer0: She is looking for mints to share with person0 ( <bin_282> <bin_207> <bin_828> <bin_998> ). answer1: person0 ( <bin_282> <bin_207> <bin_828> <bin_998> ) is trying to decide if she wants to buy it. answer2: She is analyzing it because it is complicated. answer3: She's hoping people will put donations in it,What is the relationship between person0 ( <bin_103> <bin_141> <bin_441> <bin_873> ) and person1 ( <bin_428> <bin_69> <bin_971> <bin_910> ) ? answer0: They are fellow protesters. answer1: They are father and son. answer2: person0 ( <bin_103> <bin_141> <bin_441> <bin_873> ) and person1 ( <bin_428> <bin_69> <bin_971> <bin_910> ) are intimate. answer3: They are husband and wife,answer0,answer1,answer1,answer2,answer3,answer0,answer1,answer1,answer2,answer3,Everyone is dressed in business attire and they are all standing in a line,person2 is handing out a proposal to the crowd,person0 is wearing a white coat and is sitting on couch0,She is looking at refrigerator0 and has a look of confusion on her face,They are sitting at the same table and are dressed in formal attire,"person1 and person2 and person3, and person7 are wearing tie0 and tie1 and tie2 and tie3, which they wouldn't do if they were at home","person0 and person3 and person6 seem friendly with person2, who is holding a pamphlet as they all prepare to board a train person2 seems to be trying to convince them to take an action he wants","person1 seems to be annoyed or not at ease, person0 is over exaggerating his comfiness, to get person1 to open up and talk",There are many pictures there are many arrows on refrigerator0,They are sitting next to each other at a dinner table,Where is everyone standing right now,What is person2 proposing to the crowd,Why is person0 lounging on couch0 when person1 is in a wheelchair,Why is person0 looking at refrigerator0,What is the relationship between person0 and person1,They are at an office or a work party.,He is begging the people to be reasonable with their demands.,They were in an accident and can't sit up.,She is looking for mints to share with person0.,They are fellow protesters.,They are at the dinner table.,person2 is trying to sell person0 and person3 and person6 on his proposal for what they do on this trip.,person0 is trying to make person1 more comfortable.,person0 is trying to decide if she wants to buy it.,They are father and son.,They are standing on a ship.,Accessing the damage that his employees caused.,person0 is aged and injured.,She is analyzing it because it is complicated.,person0 and person1 are intimate.,They are in a restaurant,He is trying to motivate them to leave this room and cheer up,person0 is using crutches,She's hoping people will put donations in it,They are husband and wife,val-11093.jpg,val-8776.jpg,val-18850.jpg,val-25597.jpg,val-16765.jpg
180,25978,12358,9275,2353,2898,val-25979,val-12359,val-9276,val-2354,val-2899,What is person0 ( <bin_254> <bin_82> <bin_617> <bin_988> ) telling person6 ( <bin_539> <bin_10> <bin_916> <bin_980> ) ? answer0: She is telling him all the wonderfully healthy things that are in this smoothie. answer1: A story about something that upset her. answer2: She is telling the mother of the bride that she doesn't want to be a bridesmaid and she's going home. answer3: person0 ( <bin_254> <bin_82> <bin_617> <bin_988> ) appears to be giving person6 ( <bin_539> <bin_10> <bin_916> <bin_980> ) her contact information,"What are person0 ( <bin_162> <bin_223> <bin_494> <bin_983> ) and person1 ( <bin_571> <bin_57> <bin_746> <bin_779> ) after ? answer0: People showing up to the cabin. answer1: person0 ( <bin_162> <bin_223> <bin_494> <bin_983> ) and person1 ( <bin_571> <bin_57> <bin_746> <bin_779> ) have seen too many children tied to ropes, crossing the railroad and decided to get lunch. answer2: They are after the chest behind person4 ( <bin_584> <bin_62> <bin_671> <bin_623> ). answer3: They have someone stashed in a unit and they are going to get information from someone and then kill them",What is person0 ( <bin_639> <bin_46> <bin_753> <bin_723> ) going to do next ? answer0: She is going to get out of the chair and walk away. answer1: She is going to get in the taxi - cab. answer2: person0 ( <bin_639> <bin_46> <bin_753> <bin_723> ) is going to come down the stairs to join her party in session on the lawn. answer3: person0 ( <bin_639> <bin_46> <bin_753> <bin_723> ) is going to dip her handkerchief in the water,What is person0 ( <bin_526> <bin_233> <bin_778> <bin_981> ) doing ? answer0: person1 ( <bin_167> <bin_518> <bin_293> <bin_789> ) is watching footage of a shipwreck underwater. answer1: person0 ( <bin_526> <bin_233> <bin_778> <bin_981> ) is dancing with person1 ( <bin_167> <bin_518> <bin_293> <bin_789> ). answer2: person0 ( <bin_526> <bin_233> <bin_778> <bin_981> ) is preparing for court. answer3: person0 ( <bin_526> <bin_233> <bin_778> <bin_981> ) is talking to person1 ( <bin_167> <bin_518> <bin_293> <bin_789> ) while walking,"Would person1 ( <bin_124> <bin_468> <bin_211> <bin_925> ) be willing to use cellphone0 ( <bin_658> <bin_210> <bin_701> <bin_278> ) like person0 ( <bin_579> <bin_70> <bin_810> <bin_991> ) is ? answer0: person0 ( <bin_579> <bin_70> <bin_810> <bin_991> ) will accept person0 ( <bin_579> <bin_70> <bin_810> <bin_991> ) has some connection to person1 ( <bin_124> <bin_468> <bin_211> <bin_925> ) already. answer1: Anyone can use cellphone0 ( <bin_658> <bin_210> <bin_701> <bin_278> ) the way person0 ( <bin_579> <bin_70> <bin_810> <bin_991> ) is, including person1 ( <bin_124> <bin_468> <bin_211> <bin_925> ), without any moral problems. answer2: Yes you would. answer3: No, that wouldn't be acceptable",answer2,answer2,answer2,answer2,answer1,answer2,answer2,answer2,answer2,answer1,person0 is dressed as a bridesmaid and is holding a tray of food,person4 is tied to the chest and person0 and person1 are looking at him,person0 is wearing a party dress and is standing on the porch of a house,person0 is sitting in a courtroom,person1 is a child and children are not allowed to use cellphones,She is wearing a bridesmaid style dress and person6 is in a mother f the bride style suit,The chest appears to be valuable and seems to contain something of worth to the right person,person0 is at the top of the stairs getting ready to come down while there are party decorations off to the side of the yard indicating a party,person0 is reading notes off an index card and there are several large books open,cellphone0 is a near universally accepted piece of technology,What is person0 telling person6,What are person0 and person1 after,What is person0 going to do next,What is person0 doing,Would person1 be willing to use cellphone0 like person0 is,She is telling him all the wonderfully healthy things that are in this smoothie.,People showing up to the cabin.,She is going to get out of the chair and walk away.,person1 is watching footage of a shipwreck underwater.,person0 will accept person0 has some connection to person1 already.,A story about something that upset her.,"person0 and person1 have seen too many children tied to ropes, crossing the railroad and decided to get lunch.",She is going to get in the taxi - cab.,person0 is dancing with person1.,"Anyone can use cellphone0 the way person0 is, including person1, without any moral problems.",She is telling the mother of the bride that she doesn't want to be a bridesmaid and she's going home.,They are after the chest behind person4.,person0 is going to come down the stairs to join her party in session on the lawn.,person0 is preparing for court.,Yes you would.,person0 appears to be giving person6 her contact information,They have someone stashed in a unit and they are going to get information from someone and then kill them,person0 is going to dip her handkerchief in the water,person0 is talking to person1 while walking,"No, that wouldn't be acceptable",val-25979.jpg,val-12359.jpg,val-9276.jpg,val-2354.jpg,val-2899.jpg
