index,index_0,index_1,index_2,index_3,index_4,id_0,id_1,id_2,id_3,id_4,question_0,question_1,question_2,question_3,question_4,answer_0,answer_1,answer_2,answer_3,answer_4,output_answer_0,output_answer_1,output_answer_2,output_answer_3,output_answer_4,output_explanation_0,output_explanation_1,output_explanation_2,output_explanation_3,output_explanation_4,explanation_0,explanation_1,explanation_2,explanation_3,explanation_4,processed_question_0,processed_question_1,processed_question_2,processed_question_3,processed_question_4,answer0_0,answer0_1,answer0_2,answer0_3,answer0_4,answer1_0,answer1_1,answer1_2,answer1_3,answer1_4,answer2_0,answer2_1,answer2_2,answer2_3,answer2_4,answer3_0,answer3_1,answer3_2,answer3_3,answer3_4,img_name_0,img_name_1,img_name_2,img_name_3,img_name_4
215,23370,4794,22169,21163,9009,val-23371,val-4795,val-22170,val-21164,val-9010,Why is person4 ( <bin_111> <bin_427> <bin_172> <bin_627> ) leaning over person3 ( <bin_182> <bin_511> <bin_255> <bin_762> ) ? answer0: person1 ( <bin_244> <bin_246> <bin_489> <bin_971> ) is telling person3 ( <bin_182> <bin_511> <bin_255> <bin_762> ) to stop. answer1: person4 ( <bin_111> <bin_427> <bin_172> <bin_627> ) is yelling at person3 ( <bin_182> <bin_511> <bin_255> <bin_762> ). answer2: person4 ( <bin_111> <bin_427> <bin_172> <bin_627> ) is taking person3 ( <bin_182> <bin_511> <bin_255> <bin_762> )'s meal order. answer3: person4 ( <bin_111> <bin_427> <bin_172> <bin_627> ) is telling person3 ( <bin_182> <bin_511> <bin_255> <bin_762> ) something private,"Is person0 ( <bin_159> <bin_374> <bin_253> <bin_978> ) driving a car ? answer0: Yes, they are in a limo. answer1: Yes, person0 ( <bin_159> <bin_374> <bin_253> <bin_978> ) is driving a car. answer2: No, person0 ( <bin_159> <bin_374> <bin_253> <bin_978> ) is not driving a car. answer3: Yes, person0 ( <bin_159> <bin_374> <bin_253> <bin_978> ) is stealing",Why is person2 ( <bin_221> <bin_362> <bin_355> <bin_781> ) tossing pottedplant0 ( <bin_119> <bin_405> <bin_219> <bin_714> ) overboard ? answer0: There is a storm on the boat. answer1: The boat is sinking and person2 ( <bin_221> <bin_362> <bin_355> <bin_781> ) is trying to get to higher ground. answer2: person2 ( <bin_221> <bin_362> <bin_355> <bin_781> ) is disposing of extra water on the deck. answer3: person2 ( <bin_221> <bin_362> <bin_355> <bin_781> ) is trying to get the war clean to work on it,What will everyone do next ? answer0: They will clap when person0 ( <bin_283> <bin_165> <bin_555> <bin_760> ) is done talking. answer1: Everyone will drink champagne. answer2: They will fight in a battle. answer3: Everyone will sign the papers in front of them,How does person1 ( <bin_923> <bin_558> <bin_998> <bin_979> ) feeling about what is happening ? answer0: person1 ( <bin_923> <bin_558> <bin_998> <bin_979> ) is enjoying what is going on. answer1: person3 ( <bin_928> <bin_439> <bin_971> <bin_551> ) feels very uncomfortable and does not want to be there. answer2: person1 ( <bin_923> <bin_558> <bin_998> <bin_979> ) isn't that excited. answer3: person5 ( <bin_941> <bin_490> <bin_977> <bin_615> ) looks a little upset by what is happening,answer2,answer2,answer2,answer1,answer0,answer2,answer2,answer2,answer1,answer0,person4 is a waitress and person3 is a customer,person0 is walking on the street and not in a car,person2 is on a boat and is trying to get the water off of the deck,There is a bottle of champagne on the table and they are all dressed up,person1 is standing and watching the fire,person4 appears to be writing on a pad as he looks down on person3,person0 is walking on the street,pottedplant0 appears to be a bucket of water it is typical for people on a ship to toss extra water overboard,"It is best to drink champagne before allowing it to stand for too long, so it doesn't lose its bubbles",He moved in front of everyone to get a closer look he is proud and his chin is raised in the air,Why is person4 leaning over person3,Is person0 driving a car,Why is person2 tossing pottedplant0 overboard,What will everyone do next,How does person1 feeling about what is happening,person1 is telling person3 to stop.,"Yes, they are in a limo.",There is a storm on the boat.,They will clap when person0 is done talking.,person1 is enjoying what is going on.,person4 is yelling at person3.,"Yes, person0 is driving a car.",The boat is sinking and person2 is trying to get to higher ground.,Everyone will drink champagne.,person3 feels very uncomfortable and does not want to be there.,person4 is taking person3's meal order.,"No, person0 is not driving a car.",person2 is disposing of extra water on the deck.,They will fight in a battle.,person1 isn't that excited.,person4 is telling person3 something private,"Yes, person0 is stealing",person2 is trying to get the war clean to work on it,Everyone will sign the papers in front of them,person5 looks a little upset by what is happening,val-23371.jpg,val-4795.jpg,val-22170.jpg,val-21164.jpg,val-9010.jpg
220,16082,1760,24733,21331,3878,val-16083,val-1761,val-24734,val-21332,val-3879,Why is person6 ( <bin_647> <bin_390> <bin_744> <bin_865> ) hugging someone ? answer0: person6 ( <bin_647> <bin_390> <bin_744> <bin_865> ) is saying goodbye to people on the ship. answer1: person6 ( <bin_647> <bin_390> <bin_744> <bin_865> ) is feeling overwhelmed with joy. answer2: person6 ( <bin_647> <bin_390> <bin_744> <bin_865> ) is very happy. answer3: person6 ( <bin_647> <bin_390> <bin_744> <bin_865> ) is kissing it for good luck,Where are person0 ( <bin_661> <bin_429> <bin_720> <bin_683> ) and person1 ( <bin_96> <bin_317> <bin_178> <bin_701> ) ? answer0: They are in a kitchen. answer1: They are in an arena. answer2: They are in a hospital waiting room. answer3: They are in a cave,Why is person1 ( <bin_483> <bin_239> <bin_868> <bin_990> ) reaching into his pocket ? answer0: He is going to take the letter from person4 ( <bin_524> <bin_189> <bin_606> <bin_673> ) and read it. answer1: He is getting a mint from his pants pocket. answer2: He is pulling out a business card to hand to person2 ( <bin_238> <bin_48> <bin_559> <bin_976> ). answer3: He is grabbing person1 ( <bin_483> <bin_239> <bin_868> <bin_990> )'s purse for her,What is person4 ( <bin_226> <bin_154> <bin_429> <bin_947> ) talking to the others about ? answer0: person4 ( <bin_226> <bin_154> <bin_429> <bin_947> ) is giving a speech to inspire the team to win. answer1: person4 ( <bin_226> <bin_154> <bin_429> <bin_947> ) has just arrived to the crowd and is asking what is happening. answer2: person4 ( <bin_226> <bin_154> <bin_429> <bin_947> ) is confessing to a priest. answer3: person4 ( <bin_226> <bin_154> <bin_429> <bin_947> ) is trying to work out an escape plan,What would happen if person1 ( <bin_229> <bin_35> <bin_465> <bin_318> ) took bottle0 ( <bin_79> <bin_179> <bin_229> <bin_904> ) from person0 ( <bin_88> <bin_0> <bin_979> <bin_998> ) ? answer0: They would try to rip the staff from person1 ( <bin_229> <bin_35> <bin_465> <bin_318> )'s hand and drink it themselves. answer1: person0 ( <bin_88> <bin_0> <bin_979> <bin_998> ) would accept the drink. answer2: person0 ( <bin_88> <bin_0> <bin_979> <bin_998> ) would shoot person1 ( <bin_229> <bin_35> <bin_465> <bin_318> ). answer3: person0 ( <bin_88> <bin_0> <bin_979> <bin_998> ) would be very mad,answer1,answer1,answer2,answer3,answer3,answer1,answer1,answer2,answer3,answer3,person6 is smiling and clapping her hands,There are rows of seats in the background,person2 is dressed like a business man and person1 is dressed like a gentleman and person1 is reaching into his pocket to pull out a business card,person4 is wearing a safety vest and is looking at the ground,person0 is holding bottle0 in his hands and would not want it to be taken,Holding another person closely is a common form of endearment,There is a basktetball court surrounded by hundreds of seats,person1 is reaching into his jacket pocket as he looks person2,"person4 and the others are in a dark room and they all look worried, so they are likely talking about how they can get out of the location",person0 is drunk and wants to drink more,Why is person6 hugging someone,Where are person0 and person1,Why is person1 reaching into his pocket,What is person4 talking to the others about,What would happen if person1 took bottle0 from person0,person6 is saying goodbye to people on the ship.,They are in a kitchen.,He is going to take the letter from person4 and read it.,person4 is giving a speech to inspire the team to win.,They would try to rip the staff from person1's hand and drink it themselves.,person6 is feeling overwhelmed with joy.,They are in an arena.,He is getting a mint from his pants pocket.,person4 has just arrived to the crowd and is asking what is happening.,person0 would accept the drink.,person6 is very happy.,They are in a hospital waiting room.,He is pulling out a business card to hand to person2.,person4 is confessing to a priest.,person0 would shoot person1.,person6 is kissing it for good luck,They are in a cave,He is grabbing person1's purse for her,person4 is trying to work out an escape plan,person0 would be very mad,val-16083.jpg,val-1761.jpg,val-24734.jpg,val-21332.jpg,val-3879.jpg
225,2987,3790,6907,15377,6868,val-2988,val-3791,val-6908,val-15378,val-6869,What is in vase0 ( <bin_734> <bin_807> <bin_756> <bin_901> ) on the desk in front of person0 ( <bin_177> <bin_463> <bin_386> <bin_978> ) ? answer0: pottedplant0 ( <bin_666> <bin_617> <bin_794> <bin_916> ) is in vase0 ( <bin_734> <bin_807> <bin_756> <bin_901> ) that is on the desk in front of person0 ( <bin_177> <bin_463> <bin_386> <bin_978> ). answer1: A gift for person0 ( <bin_177> <bin_463> <bin_386> <bin_978> ). answer2: Wine glass vase0 ( <bin_734> <bin_807> <bin_756> <bin_901> ) has wine in it. answer3: vase0 ( <bin_734> <bin_807> <bin_756> <bin_901> ) contained salad dressed,Why is person0 ( <bin_687> <bin_285> <bin_851> <bin_985> ) wearing a hat ? answer0: Because it is cold outside. answer1: It is raining outside. answer2: person0 ( <bin_687> <bin_285> <bin_851> <bin_985> ) is wearing a hat because of social customs. answer3: It is sunny outside,"Why does person0 ( <bin_556> <bin_150> <bin_823> <bin_984> ) look scared ? answer0: person0 ( <bin_556> <bin_150> <bin_823> <bin_984> ) does not know who person1 ( <bin_108> <bin_122> <bin_513> <bin_974> ) is, and he made her get in the car. answer1: He hears a strange noise outside. answer2: Someone is threatening him. answer3: He knows he may drown",Why are person0 ( <bin_391> <bin_294> <bin_752> <bin_899> ) and person1 ( <bin_25> <bin_261> <bin_311> <bin_899> ) smiling ? answer0: Their other friend just walked into the bar. answer1: person0 ( <bin_391> <bin_294> <bin_752> <bin_899> ) and person1 ( <bin_25> <bin_261> <bin_311> <bin_899> ) really like each other. answer2: They are happy and excited to be together. answer3: person4 ( <bin_336> <bin_201> <bin_559> <bin_744> ) is relaying a funny story to them,What is person2 ( <bin_377> <bin_202> <bin_873> <bin_984> ) thinking about ? answer0: She is thinking about children's performance. answer1: person2 ( <bin_377> <bin_202> <bin_873> <bin_984> ) is contemplating a what she was reading about in book0 ( <bin_705> <bin_631> <bin_878> <bin_741> ). answer2: person1 ( <bin_697> <bin_281> <bin_855> <bin_639> ) is thinking that she is not going to let person2 ( <bin_377> <bin_202> <bin_873> <bin_984> ) bother her. answer3: She is considering kissing person2 ( <bin_377> <bin_202> <bin_873> <bin_984> ),answer0,answer1,answer0,answer0,answer1,answer0,answer1,answer0,answer0,answer1,pottedplant0 is a plant that is in a vase,There is rain falling from the sky,person0 is looking at person1 with a scared look on her face,They are both smiling and looking in the same direction,person2 is looking at book0 with a look of deep thought,On the desk in front of person0 there is vase0 sitting on it with pottedplant0 in it,A hat protects you from the rain,People feel frightened when they are taken by someone else,People are usually happy when the person they have been waiting for arrives,person2 is likely reading book0 and thinking about what she read,What is in vase0 on the desk in front of person0,Why is person0 wearing a hat,Why does person0 look scared,Why are person0 and person1 smiling,What is person2 thinking about,pottedplant0 is in vase0 that is on the desk in front of person0.,Because it is cold outside.,"person0 does not know who person1 is, and he made her get in the car.",Their other friend just walked into the bar.,She is thinking about children's performance.,A gift for person0.,It is raining outside.,He hears a strange noise outside.,person0 and person1 really like each other.,person2 is contemplating a what she was reading about in book0.,Wine glass vase0 has wine in it.,person0 is wearing a hat because of social customs.,Someone is threatening him.,They are happy and excited to be together.,person1 is thinking that she is not going to let person2 bother her.,vase0 contained salad dressed,It is sunny outside,He knows he may drown,person4 is relaying a funny story to them,She is considering kissing person2,val-2988.jpg,val-3791.jpg,val-6908.jpg,val-15378.jpg,val-6869.jpg
230,18951,14017,21084,4804,7362,val-18952,val-14018,val-21085,val-4805,val-7363,Why are person1 ( <bin_546> <bin_181> <bin_648> <bin_631> ) and person2 ( <bin_444> <bin_162> <bin_523> <bin_388> ) talking to person4 ( <bin_451> <bin_213> <bin_569> <bin_817> ) ? answer0: person1 ( <bin_546> <bin_181> <bin_648> <bin_631> ) and person2 ( <bin_444> <bin_162> <bin_523> <bin_388> ) realize that person4 ( <bin_451> <bin_213> <bin_569> <bin_817> ) is an undercover cop. answer1: Because person1 ( <bin_546> <bin_181> <bin_648> <bin_631> ) and person2 ( <bin_444> <bin_162> <bin_523> <bin_388> ) are ordering a drink from person4 ( <bin_451> <bin_213> <bin_569> <bin_817> ). answer2: They are making plans to study. answer3: person1 ( <bin_546> <bin_181> <bin_648> <bin_631> ) and person2 ( <bin_444> <bin_162> <bin_523> <bin_388> ) are anxious about what important decision person4 ( <bin_451> <bin_213> <bin_569> <bin_817> ) will make,Why is everyone sitting with their heads down ? answer0: They are listening to person5 ( <bin_1> <bin_227> <bin_144> <bin_969> ) and waiting for the class to start. answer1: They are at a funeral. answer2: They are praying before dinner. answer3: They are sitting to work on the control boards that are in front of them,Why does person17 ( <bin_296> <bin_288> <bin_391> <bin_541> ) look so pained ? answer0: Person to is holding a knife to his throat. answer1: person17 ( <bin_296> <bin_288> <bin_391> <bin_541> ) just slapped him. answer2: He is injured and is experiencing significant pain. answer3: person17 ( <bin_296> <bin_288> <bin_391> <bin_541> ) is disgusted with the behavior of the trainees in front of him,Why does person1 ( <bin_145> <bin_234> <bin_544> <bin_988> ) have a pencil in his hand ? answer0: person2 ( <bin_506> <bin_429> <bin_822> <bin_821> ) is helping another person solve a problem. answer1: person1 ( <bin_145> <bin_234> <bin_544> <bin_988> ) might be studying for a test. answer2: person1 ( <bin_145> <bin_234> <bin_544> <bin_988> ) is signing documents. answer3: person1 ( <bin_145> <bin_234> <bin_544> <bin_988> ) is plotting movements on the map of troops,Where are person0 ( <bin_723> <bin_11> <bin_971> <bin_923> ) and person1 ( <bin_264> <bin_136> <bin_607> <bin_958> ) ? answer0: person0 ( <bin_723> <bin_11> <bin_971> <bin_923> ) and person1 ( <bin_264> <bin_136> <bin_607> <bin_958> ) are at a restaurant. answer1: person0 ( <bin_723> <bin_11> <bin_971> <bin_923> ) and person1 ( <bin_264> <bin_136> <bin_607> <bin_958> ) are at an art gallery. answer2: They are inside a tank. answer3: They are on the rooftop balcony,answer2,answer2,answer3,answer2,answer2,answer2,answer2,answer3,answer2,answer2,They are wearing backpacks and are in a school,They are all sitting at a table with food and drinks and their hands are clasped together,person17 is wearing a uniform and is standing in front of a large group of trainees,person1 is sitting at a desk with a pen in his hand and a paper in front of him,There are tanks in the back of the vehicle,person4 is carrying backpack0 which indicates she is coming from class,Most of them also have their hands in front of them which combined with bowed heads is a common position to pray in,person17 is a military officer based off uniform and appears to be teaching a class which is the reason he is upset,There is a stack of documents under the hands of person1,The room is completely metal and has similar items in it a tank would have,Why are person1 and person2 talking to person4,Why is everyone sitting with their heads down,Why does person17 look so pained,Why does person1 have a pencil in his hand,Where are person0 and person1,person1 and person2 realize that person4 is an undercover cop.,They are listening to person5 and waiting for the class to start.,Person to is holding a knife to his throat.,person2 is helping another person solve a problem.,person0 and person1 are at a restaurant.,Because person1 and person2 are ordering a drink from person4.,They are at a funeral.,person17 just slapped him.,person1 might be studying for a test.,person0 and person1 are at an art gallery.,They are making plans to study.,They are praying before dinner.,He is injured and is experiencing significant pain.,person1 is signing documents.,They are inside a tank.,person1 and person2 are anxious about what important decision person4 will make,They are sitting to work on the control boards that are in front of them,person17 is disgusted with the behavior of the trainees in front of him,person1 is plotting movements on the map of troops,They are on the rooftop balcony,val-18952.jpg,val-14018.jpg,val-21085.jpg,val-4805.jpg,val-7363.jpg
235,15184,6021,22061,12140,8296,val-15185,val-6022,val-22062,val-12141,val-8297,How is person3 ( <bin_193> <bin_343> <bin_347> <bin_978> ) feeling now ? answer0: He feels exhausted because he has had a long day. answer1: He is totally excited about seeing person3 ( <bin_193> <bin_343> <bin_347> <bin_978> ). answer2: He is upset and does believe what person2 ( <bin_455> <bin_160> <bin_685> <bin_988> ) is saying. answer3: He is terrified and struggling for breath,"Will person0 ( <bin_287> <bin_586> <bin_314> <bin_749> ) and person1 ( <bin_780> <bin_532> <bin_812> <bin_738> ), and person2 ( <bin_896> <bin_548> <bin_939> <bin_753> ) run to catch up to person3 ( <bin_293> <bin_0> <bin_799> <bin_989> ) ? answer0: No, they're hoping she doesn't look their way. answer1: Yes person3 ( <bin_293> <bin_0> <bin_799> <bin_989> ) is late and rushing. answer2: No, they will not run to catch up to person3 ( <bin_293> <bin_0> <bin_799> <bin_989> ). answer3: Yes, person0 ( <bin_287> <bin_586> <bin_314> <bin_749> ) and person1 ( <bin_780> <bin_532> <bin_812> <bin_738> ) can outrun person3 ( <bin_293> <bin_0> <bin_799> <bin_989> ), and person2 ( <bin_896> <bin_548> <bin_939> <bin_753> )",What is person0 ( <bin_517> <bin_123> <bin_836> <bin_959> ) sitting down to do ? answer0: Have a meeting with person0 ( <bin_517> <bin_123> <bin_836> <bin_959> ). answer1: person0 ( <bin_517> <bin_123> <bin_836> <bin_959> ) is going to play the piano. answer2: person1 ( <bin_157> <bin_761> <bin_334> <bin_992> ) is sitting down to eat lunch. answer3: person0 ( <bin_517> <bin_123> <bin_836> <bin_959> ) is sitting down to eat a meal,"Does person0 ( <bin_319> <bin_113> <bin_694> <bin_971> ) care about their appearance ? answer0: No, person0 ( <bin_319> <bin_113> <bin_694> <bin_971> ) doesn't care at all. answer1: Yes person0 ( <bin_319> <bin_113> <bin_694> <bin_971> ) cares about their appearance. answer2: person0 ( <bin_319> <bin_113> <bin_694> <bin_971> ) does not care for person5 ( <bin_0> <bin_148> <bin_165> <bin_960> ). answer3: No person2 ( <bin_860> <bin_193> <bin_998> <bin_994> ) is unhappy to see them","Why is person1 ( <bin_54> <bin_1> <bin_476> <bin_982> ) looking away from person0 ( <bin_585> <bin_242> <bin_819> <bin_978> ) ? answer0: person1 ( <bin_54> <bin_1> <bin_476> <bin_982> ) turned away when person0 ( <bin_585> <bin_242> <bin_819> <bin_978> ) broke the bad news. answer1: person1 ( <bin_54> <bin_1> <bin_476> <bin_982> ) is angry with person0 ( <bin_585> <bin_242> <bin_819> <bin_978> ). answer2: person0 ( <bin_585> <bin_242> <bin_819> <bin_978> ) is about to light a cigarette, and person1 ( <bin_54> <bin_1> <bin_476> <bin_982> ) doesn't approve. answer3: person2 ( <bin_166> <bin_398> <bin_199> <bin_528> ) is eavesdropping on person0 ( <bin_585> <bin_242> <bin_819> <bin_978> )'s conversation",answer2,answer2,answer3,answer1,answer1,answer2,answer2,answer3,answer1,answer1,He is looking at person2 with a look of disbelief and disbelief is often a sign of disbelief,"person3 is a monster and person0 and person1, and person2 are all looking at him and appear to be trying to get away from him",person0 is sitting at a table with food in front of him,person0 is wearing a fancy dress and earrings,person1 is looking down at the ground and has a stern look on his face,He is listening to person2 with his arms crossed,None of the boys look like they intend to move person0 is seated with his hands in his lap person1 and person2 are standing with their hands in their pockets,person0 is holding onto chair2 which is in front of a plate of foo person0 is leaning downward as well,person0 took the time to put on earrings,People who are angry avoid eye contact with each other,How is person3 feeling now,"Will person0 and person1, and person2 run to catch up to person3",What is person0 sitting down to do,Does person0 care about their appearance,Why is person1 looking away from person0,He feels exhausted because he has had a long day.,"No, they're hoping she doesn't look their way.",Have a meeting with person0.,"No, person0 doesn't care at all.",person1 turned away when person0 broke the bad news.,He is totally excited about seeing person3.,Yes person3 is late and rushing.,person0 is going to play the piano.,Yes person0 cares about their appearance.,person1 is angry with person0.,He is upset and does believe what person2 is saying.,"No, they will not run to catch up to person3.",person1 is sitting down to eat lunch.,person0 does not care for person5.,"person0 is about to light a cigarette, and person1 doesn't approve.",He is terrified and struggling for breath,"Yes, person0 and person1 can outrun person3, and person2",person0 is sitting down to eat a meal,No person2 is unhappy to see them,person2 is eavesdropping on person0's conversation,val-15185.jpg,val-6022.jpg,val-22062.jpg,val-12141.jpg,val-8297.jpg
