index,index_0,index_1,index_2,index_3,index_4,id_0,id_1,id_2,id_3,id_4,question_0,question_1,question_2,question_3,question_4,answer_0,answer_1,answer_2,answer_3,answer_4,output_answer_0,output_answer_1,output_answer_2,output_answer_3,output_answer_4,output_explanation_0,output_explanation_1,output_explanation_2,output_explanation_3,output_explanation_4,explanation_0,explanation_1,explanation_2,explanation_3,explanation_4,processed_question_0,processed_question_1,processed_question_2,processed_question_3,processed_question_4,answer0_0,answer0_1,answer0_2,answer0_3,answer0_4,answer1_0,answer1_1,answer1_2,answer1_3,answer1_4,answer2_0,answer2_1,answer2_2,answer2_3,answer2_4,answer3_0,answer3_1,answer3_2,answer3_3,answer3_4,img_name_0,img_name_1,img_name_2,img_name_3,img_name_4
0,8024,8800,18512,21107,16100,val-8025,val-8801,val-18513,val-21108,val-16101,What is person20 ( <bin_544> <bin_616> <bin_590> <bin_840> ) doing ? answer0: He is waiting for person20 ( <bin_544> <bin_616> <bin_590> <bin_840> ) to leave so he can take his phone call. answer1: person20 ( <bin_544> <bin_616> <bin_590> <bin_840> ) is discussing his transition into becoming transgender with person3 ( <bin_689> <bin_758> <bin_736> <bin_884> ) and person17 ( <bin_870> <bin_751> <bin_913> <bin_916> ). answer2: He is a waiter and going to serve the table. answer3: He is trying to sell a vase to person8 ( <bin_780> <bin_502> <bin_801> <bin_548> ) and person10 ( <bin_875> <bin_354> <bin_897> <bin_490> ),"Did person3 ( <bin_124> <bin_85> <bin_595> <bin_998> ) come outside in a hurry ? answer0: No, person4 ( <bin_939> <bin_72> <bin_998> <bin_829> ) is outside. answer1: Yes person3 ( <bin_124> <bin_85> <bin_595> <bin_998> ) ran outside in a hurry. answer2: No, they hurried to the hospital. answer3: No person0 ( <bin_832> <bin_40> <bin_927> <bin_735> ) did not invite person3 ( <bin_124> <bin_85> <bin_595> <bin_998> ) inside",What does person0 ( <bin_8> <bin_41> <bin_457> <bin_662> ) want to do ? answer0: person1 ( <bin_109> <bin_28> <bin_452> <bin_435> ) is hoping to start eating. answer1: They want to listen to some music. answer2: person0 ( <bin_8> <bin_41> <bin_457> <bin_662> ) wants to have a drink with person1 ( <bin_109> <bin_28> <bin_452> <bin_435> ). answer3: person0 ( <bin_8> <bin_41> <bin_457> <bin_662> ) wants to go to bathroom,What could person3 ( <bin_41> <bin_7> <bin_286> <bin_951> ) be doing to make person1 ( <bin_496> <bin_102> <bin_995> <bin_992> ) and others angry ? answer0: person2 ( <bin_383> <bin_192> <bin_527> <bin_702> ) is handling ropes. answer1: person3 ( <bin_41> <bin_7> <bin_286> <bin_951> ) is trying to get the group to take some type of action. answer2: person1 ( <bin_496> <bin_102> <bin_995> <bin_992> ) may be doing nothing other than being in a racist bar. answer3: person4 ( <bin_92> <bin_61> <bin_452> <bin_937> ) is driving erratically,What does person1 ( <bin_122> <bin_103> <bin_706> <bin_988> ) do for work ? answer0: He is the foreman of the job site. answer1: He is a chef. answer2: He makes a living as a soldier. answer3: He is a chauffeur,answer2,answer1,answer1,answer2,answer2,answer2,answer1,answer1,answer2,answer2,He is wearing a white shirt and apron and is walking towards the table,person3 is running away from a large open door,They are reaching for a bottle of pills,person1 is wearing a very different style of clothing than the others and is standing behind a bar,He is wearing a military uniform,He is in a uniform and heading to a table,"Everyone behind person3 is dressed for cold weather, person3 is not",They are touching a stereo,person1 is the only black person in the bar and others seem upset which could indicate some racial animus,He has a gun on his back and bullets strapped to his vest,What is person20 doing,Did person3 come outside in a hurry,What does person0 want to do,What could person3 be doing to make person1 and others angry,What does person1 do for work,He is waiting for person20 to leave so he can take his phone call.,"No, person4 is outside.",person1 is hoping to start eating.,person2 is handling ropes.,He is the foreman of the job site.,person20 is discussing his transition into becoming transgender with person3 and person17.,Yes person3 ran outside in a hurry.,They want to listen to some music.,person3 is trying to get the group to take some type of action.,He is a chef.,He is a waiter and going to serve the table.,"No, they hurried to the hospital.",person0 wants to have a drink with person1.,person1 may be doing nothing other than being in a racist bar.,He makes a living as a soldier.,He is trying to sell a vase to person8 and person10,No person0 did not invite person3 inside,person0 wants to go to bathroom,person4 is driving erratically,He is a chauffeur,val-8025.jpg,val-8801.jpg,val-18513.jpg,val-21108.jpg,val-16101.jpg
5,1973,10699,19850,15373,24535,val-1974,val-10700,val-19851,val-15374,val-24536,Where person0 ( <bin_124> <bin_57> <bin_351> <bin_985> ) one walking to ? answer0: He is walking into the supermarket. answer1: He is headed home to his apartment. answer2: He is going to work. answer3: He was walking to person0 ( <bin_124> <bin_57> <bin_351> <bin_985> ),Is everyone having a pleasant conversation ? answer0: No they are not having a pleasant conversation. answer1: Not everyone is having alcoholic beverages. answer2: Yes they are enjoying themselves. answer3: Yes they are having a conversation,What are person1 ( <bin_129> <bin_278> <bin_292> <bin_975> ) and person4 ( <bin_213> <bin_314> <bin_311> <bin_955> ) doing together ? answer0: They are doing a photo shoot together for a movie. answer1: They are having dinner together. answer2: person1 ( <bin_129> <bin_278> <bin_292> <bin_975> ) and person4 ( <bin_213> <bin_314> <bin_311> <bin_955> ) are dancing with each other. answer3: They are out on a date together,What is person4 ( <bin_897> <bin_320> <bin_998> <bin_594> ) writing ? answer0: He's trying to find out a code. answer1: He is reading the news. answer2: He is taking notes. answer3: He is going to write down the conversation person3 ( <bin_481> <bin_131> <bin_612> <bin_561> ) is about to have,What did person2 ( <bin_384> <bin_89> <bin_539> <bin_995> ) just do ? answer0: He pulled out a paper from the safe. answer1: He shot the person he is looking at. answer2: He just lit a cigarette. answer3: person2 ( <bin_384> <bin_89> <bin_539> <bin_995> ) just tied up the hands of the man on the floor,answer1,answer0,answer2,answer2,answer0,answer1,answer0,answer2,answer2,answer0,He is wearing a backpack and walking down the stairs towards the front door,There are several bottles of alcohol on the table and person0 is looking at person1 with a disgusted look on his face,person1 and person4 are holding each other and are moving their bodies,He is in a classroom and is writing on a paper,He is holding a paper in his hand and is looking at it,He is walking toward an apartment door,They faces of person1 and person3 are scrunched up as if they are angry,person1 and person4 are standing close together with their hands on each other as their feet are moving around,He is in a classroom and students take notes during class,"The safe is open and he is reading the paper, so he does not know what it is",Where person0 one walking to,Is everyone having a pleasant conversation,What are person1 and person4 doing together,What is person4 writing,What did person2 just do,He is walking into the supermarket.,No they are not having a pleasant conversation.,They are doing a photo shoot together for a movie.,He's trying to find out a code.,He pulled out a paper from the safe.,He is headed home to his apartment.,Not everyone is having alcoholic beverages.,They are having dinner together.,He is reading the news.,He shot the person he is looking at.,He is going to work.,Yes they are enjoying themselves.,person1 and person4 are dancing with each other.,He is taking notes.,He just lit a cigarette.,He was walking to person0,Yes they are having a conversation,They are out on a date together,He is going to write down the conversation person3 is about to have,person2 just tied up the hands of the man on the floor,val-1974.jpg,val-10700.jpg,val-19851.jpg,val-15374.jpg,val-24536.jpg
10,21457,19367,6138,3552,11291,val-21458,val-19368,val-6139,val-3553,val-11292,"What might happen to person3 ( <bin_35> <bin_431> <bin_80> <bin_790> ) and person1 ( <bin_73> <bin_436> <bin_127> <bin_790> ) next ? answer0: person3 ( <bin_35> <bin_431> <bin_80> <bin_790> ) and person1 ( <bin_73> <bin_436> <bin_127> <bin_790> ) are going to be late for class. answer1: The other guys will put one of them in the trash can. answer2: person4 ( <bin_592> <bin_322> <bin_640> <bin_463> ) and person5 ( <bin_235> <bin_341> <bin_410> <bin_865> ) might pass out. answer3: They will be fine, nothing bad is going to happen",Why is person1 ( <bin_701> <bin_142> <bin_916> <bin_965> ) wearing a sock on his head ? answer0: He twisted his ankle during training and he is in pain. answer1: He just got done playing a game of quidich. answer2: person1 ( <bin_701> <bin_142> <bin_916> <bin_965> ) has a bandage on his head because he was recently injured there. answer3: person1 ( <bin_701> <bin_142> <bin_916> <bin_965> ) is hiding his identity,"What does person0 ( <bin_189> <bin_75> <bin_850> <bin_977> ) have in his hand ? answer0: He has a drink in his hand. answer1: He's holding a violin. answer2: He keeps books, paper, pens, and his wallet. answer3: person0 ( <bin_189> <bin_75> <bin_850> <bin_977> ) has a knife in his eye",What is everyone watching ? answer0: They are watching a competition. answer1: They are watching person2 ( <bin_667> <bin_56> <bin_850> <bin_975> ). answer2: They are watching the fire. answer3: There is a show going on in the center,Where are person0 ( <bin_307> <bin_46> <bin_945> <bin_979> ) and person4 ( <bin_5> <bin_0> <bin_390> <bin_996> ) ? answer0: person0 ( <bin_307> <bin_46> <bin_945> <bin_979> ) and person4 ( <bin_5> <bin_0> <bin_390> <bin_996> ) are in the backyard of a house. answer1: They are in venice. answer2: person3 ( <bin_672> <bin_163> <bin_830> <bin_718> ) and person2 ( <bin_844> <bin_302> <bin_997> <bin_948> ) are in an underground room. answer3: person0 ( <bin_307> <bin_46> <bin_945> <bin_979> ) and person4 ( <bin_5> <bin_0> <bin_390> <bin_996> ) are at a restaurant,answer1,answer3,answer0,answer3,answer3,answer1,answer3,answer0,answer3,answer3,They are in a fight and the other guys are trying to get them out of there,person1 is a police officer and is trying to protect himself,He is holding a glass in his hand and there is a bottle of alcohol on the bar behind him,Everyone is facing the center of the building and there is a stage in front of them,person0 and person4 are sitting at a table with other people sitting at tables behind them,person1 and person3 look scared an one common form of bullying is to be put in a trash can,person1 is a criminal and doesn't want to be recognized,He is holding a glass and is at a bar,You can see a red curtain,There are people sitting at tables with drinks,What might happen to person3 and person1 next,Why is person1 wearing a sock on his head,What does person0 have in his hand,What is everyone watching,Where are person0 and person4,person3 and person1 are going to be late for class.,He twisted his ankle during training and he is in pain.,He has a drink in his hand.,They are watching a competition.,person0 and person4 are in the backyard of a house.,The other guys will put one of them in the trash can.,He just got done playing a game of quidich.,He's holding a violin.,They are watching person2.,They are in venice.,person4 and person5 might pass out.,person1 has a bandage on his head because he was recently injured there.,"He keeps books, paper, pens, and his wallet.",They are watching the fire.,person3 and person2 are in an underground room.,"They will be fine, nothing bad is going to happen",person1 is hiding his identity,person0 has a knife in his eye,There is a show going on in the center,person0 and person4 are at a restaurant,val-21458.jpg,val-19368.jpg,val-6139.jpg,val-3553.jpg,val-11292.jpg
15,17114,4262,18281,9191,15486,val-17115,val-4263,val-18282,val-9192,val-15487,What are person2 ( <bin_295> <bin_312> <bin_475> <bin_706> ) and person4 ( <bin_529> <bin_266> <bin_701> <bin_696> ) doing ? answer0: They are out on a date together. answer1: person2 ( <bin_295> <bin_312> <bin_475> <bin_706> ) and person4 ( <bin_529> <bin_266> <bin_701> <bin_696> ) are trying to intimidate person1 ( <bin_718> <bin_120> <bin_860> <bin_669> ). answer2: person2 ( <bin_295> <bin_312> <bin_475> <bin_706> ) and person4 ( <bin_529> <bin_266> <bin_701> <bin_696> ) are comforting person7 ( <bin_73> <bin_248> <bin_156> <bin_724> ). answer3: The are talking while sitting on a table,Where is person1 ( <bin_458> <bin_276> <bin_558> <bin_662> ) going ? answer0: He is going to talk with person0 ( <bin_371> <bin_151> <bin_535> <bin_645> ). answer1: He is leaving. answer2: He is going to school. answer3: He is going into a hotel,What did person0 ( <bin_128> <bin_237> <bin_294> <bin_898> ) do recently ? answer0: person0 ( <bin_128> <bin_237> <bin_294> <bin_898> ) set a wooden cross on fire. answer1: person0 ( <bin_128> <bin_237> <bin_294> <bin_898> ) worked a day of crabbing. answer2: person0 ( <bin_128> <bin_237> <bin_294> <bin_898> ) handed cup0 ( <bin_98> <bin_617> <bin_115> <bin_668> ) to person1 ( <bin_324> <bin_355> <bin_400> <bin_647> ). answer3: person0 ( <bin_128> <bin_237> <bin_294> <bin_898> ) finished a purchase in the store,What is person2 ( <bin_364> <bin_227> <bin_444> <bin_618> )'s job ? answer0: person1 ( <bin_404> <bin_357> <bin_483> <bin_821> ) is the ship captain. answer1: person1 ( <bin_404> <bin_357> <bin_483> <bin_821> ) is a chauffeur. answer2: person2 ( <bin_364> <bin_227> <bin_444> <bin_618> ) is a librarian. answer3: person0 ( <bin_39> <bin_161> <bin_161> <bin_765> )'s job is serving drinks,"Is train0 ( <bin_221> <bin_231> <bin_401> <bin_437> ) currently in use ? answer0: No, it is there for decoration. answer1: No, train0 ( <bin_221> <bin_231> <bin_401> <bin_437> ) has been disabled. answer2: No, only person1 ( <bin_294> <bin_236> <bin_783> <bin_975> ) is using it. answer3: Yes, someone has used train0 ( <bin_221> <bin_231> <bin_401> <bin_437> )",answer0,answer2,answer3,answer2,answer1,answer0,answer2,answer3,answer2,answer1,They are sitting at a table together and eating,He is carrying a backpack,person0 is carrying a bag of food,person2 is standing in a library with a lot of books on the shelves,train0 is parked behind a concrete wall and appears to be in disrepair,They are both sitting at a table in a restaurant,person0 is escorting him to school as they both wear school uniforms,person0 is holding a bag which people often use to carry groceries,She is in a library and dressed formally,train0 looks out of date with it's paint heavily discolored and faded also the track it is on is overgrown,What are person2 and person4 doing,Where is person1 going,What did person0 do recently,What is person2's job,Is train0 currently in use,They are out on a date together.,He is going to talk with person0.,person0 set a wooden cross on fire.,person1 is the ship captain.,"No, it is there for decoration.",person2 and person4 are trying to intimidate person1.,He is leaving.,person0 worked a day of crabbing.,person1 is a chauffeur.,"No, train0 has been disabled.",person2 and person4 are comforting person7.,He is going to school.,person0 handed cup0 to person1.,person2 is a librarian.,"No, only person1 is using it.",The are talking while sitting on a table,He is going into a hotel,person0 finished a purchase in the store,person0's job is serving drinks,"Yes, someone has used train0",val-17115.jpg,val-4263.jpg,val-18282.jpg,val-9192.jpg,val-15487.jpg
20,5667,21739,21862,3410,2050,val-5668,val-21740,val-21863,val-3411,val-2051,What is person3 ( <bin_264> <bin_408> <bin_481> <bin_989> ) doing ? answer0: She is boarding a boat. answer1: person3 ( <bin_264> <bin_408> <bin_481> <bin_989> ) is serving person7 ( <bin_80> <bin_650> <bin_262> <bin_991> ) her food. answer2: She is attending a show. answer3: person3 ( <bin_264> <bin_408> <bin_481> <bin_989> ) is checking her train ticket,Who is person1 ( <bin_516> <bin_199> <bin_815> <bin_967> ) looking seductive at ? answer0: person1 ( <bin_516> <bin_199> <bin_815> <bin_967> ) is looking at person2 ( <bin_6> <bin_168> <bin_176> <bin_933> ) and person7 ( <bin_693> <bin_159> <bin_822> <bin_847> ) and person13 ( <bin_265> <bin_316> <bin_365> <bin_583> ) and person9 ( <bin_388> <bin_236> <bin_448> <bin_466> ). answer1: person13 ( <bin_265> <bin_316> <bin_365> <bin_583> ) is staring at person1 ( <bin_516> <bin_199> <bin_815> <bin_967> ). answer2: person1 ( <bin_516> <bin_199> <bin_815> <bin_967> ) is wearing a strapless dress. answer3: She is looking at a guy on the dance floor,"What kind of drink does person2 ( <bin_280> <bin_177> <bin_614> <bin_876> ) have in front of him ? answer0: person2 ( <bin_280> <bin_177> <bin_614> <bin_876> ) has a martini. answer1: person6 ( <bin_6> <bin_146> <bin_65> <bin_302> ) is drinking wine. answer2: person2 ( <bin_280> <bin_177> <bin_614> <bin_876> ) is drinking fruit punch. answer3: Coffee, most likely",What are person0 ( <bin_317> <bin_191> <bin_437> <bin_963> ) and person1 ( <bin_447> <bin_147> <bin_590> <bin_935> ) doing ? answer0: person0 ( <bin_317> <bin_191> <bin_437> <bin_963> ) and person1 ( <bin_447> <bin_147> <bin_590> <bin_935> ) are playing music. answer1: They are engaged in a fight. answer2: They are watching a news report. answer3: person7 ( <bin_610> <bin_570> <bin_627> <bin_611> ) and person2 ( <bin_196> <bin_158> <bin_350> <bin_975> ) are talking,What are the flashlights for ? answer0: They are trying to keep someone out of the room. answer1: The flashlights are for person0 ( <bin_96> <bin_215> <bin_360> <bin_992> ) and person1 ( <bin_397> <bin_230> <bin_672> <bin_959> ) to look inside oven0 ( <bin_686> <bin_98> <bin_998> <bin_955> ). answer2: They are looking for clues. answer3: They are burning the virus infected body,answer0,answer3,answer0,answer2,answer1,answer0,answer3,answer0,answer2,answer1,She is standing on a boat and looking down at the water,She is looking at the same direction as the other girls and is smiling,There is a wine glass in front of person2 and a wine glass in front of person2 that is the same color as a martini,They are standing in front of a monitor with a news story on it,person0 and person1 are wearing lab coats and are in a lab,She is standing near a boat and appears to be boarding it,person1 is looking over in a flirty pose,"person2 has wineglass2 directly in front of him, a martini glass and he is about to eat a olive off of a toothpick typically used in martinis",Something on the news has caught their attention,person0 and person1 are holding flashlights and looking at oven0,What is person3 doing,Who is person1 looking seductive at,What kind of drink does person2 have in front of him,What are person0 and person1 doing,What are the flashlights for,She is boarding a boat.,person1 is looking at person2 and person7 and person13 and person9.,person2 has a martini.,person0 and person1 are playing music.,They are trying to keep someone out of the room.,person3 is serving person7 her food.,person13 is staring at person1.,person6 is drinking wine.,They are engaged in a fight.,The flashlights are for person0 and person1 to look inside oven0.,She is attending a show.,person1 is wearing a strapless dress.,person2 is drinking fruit punch.,They are watching a news report.,They are looking for clues.,person3 is checking her train ticket,She is looking at a guy on the dance floor,"Coffee, most likely",person7 and person2 are talking,They are burning the virus infected body,val-5668.jpg,val-21740.jpg,val-21863.jpg,val-3411.jpg,val-2051.jpg
25,14552,8126,19072,20126,18530,val-14553,val-8127,val-19073,val-20127,val-18531,Where are person0 ( <bin_536> <bin_359> <bin_781> <bin_912> ) and person1 ( <bin_133> <bin_272> <bin_549> <bin_978> ) sitting ? answer0: They are sitting in the cabin of an airplane. answer1: person0 ( <bin_536> <bin_359> <bin_781> <bin_912> ) and person1 ( <bin_133> <bin_272> <bin_549> <bin_978> ) are sitting in an old movie theater. answer2: person0 ( <bin_536> <bin_359> <bin_781> <bin_912> ) and person1 ( <bin_133> <bin_272> <bin_549> <bin_978> ) are sitting in a private section of a club. answer3: person0 ( <bin_536> <bin_359> <bin_781> <bin_912> ) and person1 ( <bin_133> <bin_272> <bin_549> <bin_978> ) are sitting in a car,Why is everyone here ? answer0: They are all working in an office. answer1: Everyone is on a school field trip. answer2: They are here for a party. answer3: A crime has been committed here,"Would person0 ( <bin_353> <bin_91> <bin_573> <bin_969> ) to be able to swing if she sat on the bench on the porch ? answer0: No, but person0 ( <bin_353> <bin_91> <bin_573> <bin_969> ) can probably bend the bars. answer1: No, person0 ( <bin_353> <bin_91> <bin_573> <bin_969> ) is not able to walk. answer2: Yes you would. answer3: person1 ( <bin_289> <bin_583> <bin_447> <bin_991> ) will be more comfortable after awhile",What was person2 ( <bin_290> <bin_243> <bin_514> <bin_778> ) feeling before arriving at the restaurant ? answer0: It was nice and sunny. answer1: person1 ( <bin_911> <bin_275> <bin_998> <bin_810> ) was sitting down at diningtable0 ( <bin_7> <bin_693> <bin_576> <bin_895> ). answer2: person2 ( <bin_290> <bin_243> <bin_514> <bin_778> ) was feeling a lot of hunger. answer3: The sense of belonging,Why is person1 ( <bin_80> <bin_232> <bin_415> <bin_975> ) running behind person0 ( <bin_408> <bin_43> <bin_726> <bin_988> ) ? answer0: person1 ( <bin_80> <bin_232> <bin_415> <bin_975> ) is chasing after person0 ( <bin_408> <bin_43> <bin_726> <bin_988> ). answer1: person1 ( <bin_80> <bin_232> <bin_415> <bin_975> ) wants to play basketball with person0 ( <bin_408> <bin_43> <bin_726> <bin_988> ). answer2: person1 ( <bin_80> <bin_232> <bin_415> <bin_975> ) is running for protection. answer3: dog0 ( <bin_688> <bin_405> <bin_875> <bin_983> ) wants to flee,answer2,answer0,answer2,answer2,answer2,answer2,answer0,answer2,answer2,answer2,"person0 and person1 are sitting on a booth in a club, and there are other tables around them",They are all sitting at desks and appear to be working,The bench is right next to the porch and it is a swing,person2 is sitting at a table with food in front of her,person1 is running in the dark and is wearing a hooded jacket,"They are sitting at ease snorting cocaine, there is a screen that offers privacy from the rest of the club",They are sitting and tables and person2 appears to be typing on a keyboard while others are looking at monitors,The bench is suspended by chains because it is a porch swing,People go to restaurants when they are hungry,"Since person1 is on the run and person0 has a gun out facing away from them both, it looks like person0 would be running so as to get away from whatever danger there is",Where are person0 and person1 sitting,Why is everyone here,Would person0 to be able to swing if she sat on the bench on the porch,What was person2 feeling before arriving at the restaurant,Why is person1 running behind person0,They are sitting in the cabin of an airplane.,They are all working in an office.,"No, but person0 can probably bend the bars.",It was nice and sunny.,person1 is chasing after person0.,person0 and person1 are sitting in an old movie theater.,Everyone is on a school field trip.,"No, person0 is not able to walk.",person1 was sitting down at diningtable0.,person1 wants to play basketball with person0.,person0 and person1 are sitting in a private section of a club.,They are here for a party.,Yes you would.,person2 was feeling a lot of hunger.,person1 is running for protection.,person0 and person1 are sitting in a car,A crime has been committed here,person1 will be more comfortable after awhile,The sense of belonging,dog0 wants to flee,val-14553.jpg,val-8127.jpg,val-19073.jpg,val-20127.jpg,val-18531.jpg
